[
  {
    "id": "watermelon_classic",
    "type": "watermelon.collection.classic",
    "title": "Watermelon Catch 🍉",
    "prompt": "Catch the watermelons!",
    "params": {
      "wrongFeedback": "🚫",
      "wrongPenalty": 0,
      "itemValues": {
        "slice": 1,
        "face": 2,
        "gold": 10,
        "silver": 5
      },
      "timeBonuses": {
        "hourglass": 10,
        "clock": 5
      },
      "bombPenalty": 10000
    }
  }
]
